Sheet: Sheet1
B4: N | C4: FRDM | D4: relativistic continuum Hartreeâ€“Bogoliubov theory | E4: exp | F4: our resuls | H4: exp in kev E/A
B5: 155 | C5: 1916.58
B6: of:= [.B5]+1 -> 156 | C6: 1926.23
B7: of:= [.B6]+1 -> 157 | C7: 1934.24 | D7: 1919.91
B8: of:= [.B7]+1 -> 158 | C8: 1943.67 | D8: 1929.57
B9: of:= [.B8]+1 -> 159 | C9: 1951.52 | D9: 1937.25
B10: of:= [.B9]+1 -> 160 | C10: 1960.74 | D10: 1946.83
B11: of:= [.B10]+1 -> 161 | C11: 1968.37 | D11: 1954.36
B12: of:= [.B11]+1 -> 162 | C12: 1977.3 | D12: 1963.85
B13: of:= [.B12]+1 -> 163 | C13: 1984.59 | D13: 1971.11
B14: of:= [.B13]+1 -> 164 | C14: 1993.83 | D14: 1980.5
B15: of:= [.B14]+1 -> 165 | C15: 2000.77 | D15: 1987.94
B16: of:= [.B15]+1 -> 166 | C16: 2009.21 | D16: 1996.4
B17: of:= [.B16]+1 -> 167 | C17: 2015.85 | D17: 2003.69
B18: of:= [.B17]+1 -> 168 | C18: 2023.88 | D18: 2011.87
B19: of:= [.B18]+1 -> 169 | C19: 2030.13 | D19: 2019.05
B20: of:= [.B19]+1 -> 170 | C20: 2037.98 | D20: 2027.07 | E20: of:= [.H20]/1000 * ([.B20]+ 114) -> 2034.292 | H20: 7163
B21: of:= [.B20]+1 -> 171 | C21: 2044.36 | D21: 2034.13 | E21: of:= [.H21]/1000 * ([.B21]+ 114) -> 2040.315 | H21: 7159
B22: of:= [.B21]+1 -> 172 | C22: 2051.93 | D22: 2042.01 | E22: of:= [.H22]/1000 * ([.B22]+ 114) -> 2047.474 | H22: 7159
B23: of:= [.B22]+1 -> 173 | C23: 2058.11 | D23: 2048.28 | E23: of:= [.H23]/1000 * ([.B23]+ 114) -> 2053.485 | H23: 7155
B24: of:= [.B23]+1 -> 174 | C24: 2065.62 | D24: 2055.37 | E24: of:= [.H24]/1000 * ([.B24]+ 114) -> 2060.352 | H24: 7154
B25: of:= [.B24]+1 -> 175 | C25: 2071.58 | D25: 2061.44 | E25: of:= [.H25]/1000 * ([.B25]+ 114) -> 2066.061 | H25: 7149
B26: of:= [.B25]+1 -> 176 | C26: 2078.82 | D26: 2068.32 | E26: of:= [.H26]/1000 * ([.B26]+ 114) -> 2072.63 | H26: 7147
B27: of:= [.B26]+1 -> 177 | C27: 2084.47 | D27: 2074.21 | E27: of:= [.H27]/1000 * ([.B27]+ 114) -> 2078.031 | H27: 7141
B28: of:= [.B27]+1 -> 178 | C28: 2091.52 | D28: 2080.98
B29: of:= [.B28]+1 -> 179 | C29: 2096.9 | D29: 2086.79
B30: of:= [.B29]+1 -> 180 | C30: 2103.36 | D30: 2093.35
B31: of:= [.B30]+1 -> 181 | C31: 2108.51 | D31: 2099.08
B32: of:= [.B31]+1 -> 182 | C32: 2114.66 | D32: 2105.41
B33: of:= [.B32]+1 -> 183 | C33: 2119.43 | D33: 2111.13
B34: of:= [.B33]+1 -> 184 | C34: 2125.19 | D34: 2116.96
B35: of:= [.B34]+1 -> 185 | C35: 2128.8 | D35: 2120.68
B36: of:= [.B35]+1 -> 186 | C36: 2134.23 | D36: 2125.63
B37: of:= [.B36]+1 -> 187 | C37: 2137.39 | D37: 2129.34
B38: of:= [.B37]+1 -> 188 | C38: 2142.65 | D38: 2134.26
B39: of:= [.B38]+1 -> 189 | C39: 2145.78 | D39: 2137.95
B40: of:= [.B39]+1 -> 190 | C40: 2150.87 | D40: 2142.86
B41: of:= [.B40]+1 -> 191 | C41: 2153.98 | D41: 2146.54
B42: of:= [.B41]+1 -> 192 | C42: 2158.94 | D42: 2151.44
B43: of:= [.B42]+1 -> 193 | C43: 2162.11 | D43: 2155.1
B44: of:= [.B43]+1 -> 194 | C44: 2167.25 | D44: 2159.99
B45: of:= [.B44]+1 -> 195 | C45: 2170.72 | D45: 2163.62
B46: of:= [.B45]+1 -> 196 | C46: 2175.67 | D46: 2168.48
B47: of:= [.B46]+1 -> 197 | C47: 2182.37 | D47: 2172.01
B48: of:= [.B47]+1 -> 198 | C48: 2187.33 | D48: 2176.81
B49: of:= [.B48]+1 -> 199 | C49: 2188.59 | D49: 2179.76
B50: of:= [.B49]+1 -> 200 | C50: 2193.52 | D50: 2184.21
B51: of:= [.B50]+1 -> 201 | C51: 2197.06 | D51: 2187.06
B52: of:= [.B51]+1 -> 202 | C52: 2201.73 | D52: 2191.32
B53: of:= [.B52]+1 -> 203 | C53: 2204.8 | D53: 2194.09
B54: of:= [.B53]+1 -> 204 | C54: 2209.04 | D54: 2198.27
B55: of:= [.B54]+1 -> 205 | C55: 2211.93 | D55: 2200.98
B56: of:= [.B55]+1 -> 206 | C56: 2215.97 | D56: 2205.1
B57: of:= [.B56]+1 -> 207 | C57: 2218.77 | D57: 2207.76
B58: of:= [.B57]+1 -> 208 | C58: 2222.77 | D58: 2211.84
B59: of:= [.B58]+1 -> 209 | C59: 2225.5 | D59: 2214.43
B60: of:= [.B59]+1 -> 210 | C60: 2229.37 | D60: 2218.49
B61: of:= [.B60]+1 -> 211 | C61: 2232.06 | D61: 2221
B62: of:= [.B61]+1 -> 212 | C62: 2235.91 | D62: 2225.05
B63: of:= [.B62]+1 -> 213 | C63: 2238.46 | D63: 2227.49
B64: of:= [.B63]+1 -> 214 | C64: 2242.15 | D64: 2231.54
B65: of:= [.B64]+1 -> 215 | C65: 2244.55 | D65: 2233.9
B66: of:= [.B65]+1 -> 216 | C66: 2248.23 | D66: 2237.95
B67: of:= [.B66]+1 -> 217 | C67: 2250.52 | D67: 2240.3
B68: of:= [.B67]+1 -> 218 | C68: 2253.98 | D68: 2244.29
B69: of:= [.B68]+1 -> 219 | C69: 2256.07 | D69: 2246.62
B70: of:= [.B69]+1 -> 220 | C70: 2259.52 | D70: 2250.56
B71: of:= [.B70]+1 -> 221 | C71: 2261.7 | D71: 2252.86
B72: of:= [.B71]+1 -> 222 | C72: 2265.16 | D72: 2256.75
B73: of:= [.B72]+1 -> 223 | C73: 2267.59 | D73: 2259.01
B74: of:= [.B73]+1 -> 224 | C74: 2271.24 | D74: 2262.86
B75: of:= [.B74]+1 -> 225 | C75: 2273.53 | D75: 2265.05
B76: of:= [.B75]+1 -> 226 | D76: 2268.88
B77: of:= [.B76]+1 -> 227 | D77: 2271.09
B78: of:= [.B77]+1 -> 228 | D78: 2274.78
B79: of:= [.B78]+1 -> 229 | D79: 2277.06
B80: of:= [.B79]+1 -> 230 | D80: 2280.54
B81: of:= [.B80]+1 -> 231 | D81: 2282.84
B82: of:= [.B81]+1 -> 232 | D82: 2286.17
B83: of:= [.B82]+1 -> 233 | D83: 2288.46
B84: of:= [.B83]+1 -> 234 | D84: 2291.69
B85: of:= [.B84]+1 -> 235 | D85: 2293.94
B86: of:= [.B85]+1 -> 236 | D86: 2297.1
B87: of:= [.B86]+1 -> 237 | D87: 2299.24
B88: of:= [.B87]+1 -> 238 | D88: 2302.34
B89: of:= [.B88]+1 -> 239 | D89: 2304.34
B90: of:= [.B89]+1 -> 240 | D90: 2307.19
B91: of:= [.B90]+1 -> 241 | D91: 2309.12
B92: of:= [.B91]+1 -> 242 | D92: 2311.81
B93: of:= [.B92]+1 -> 243 | D93: 2313.68
B94: of:= [.B93]+1 -> 244 | D94: 2316.32
B95: of:= [.B94]+1 -> 245 | D95: 2318.11
B96: of:= [.B95]+1 -> 246 | D96: 2320.73
B97: of:= [.B96]+1 -> 247 | D97: 2322.52
B98: of:= [.B97]+1 -> 248 | D98: 2325.04
B99: of:= [.B98]+1 -> 249 | D99: 2326.82
B100: of:= [.B99]+1 -> 250 | D100: 2329.24
B101: of:= [.B100]+1 -> 251 | D101: 2330.96
B102: of:= [.B101]+1 -> 252 | D102: 2333.33
B103: of:= [.B102]+1 -> 253 | D103: 2335.05
B104: of:= [.B103]+1 -> 254 | D104: 2337.24
B105: of:= [.B104]+1 -> 255 | D105: 2338.92
B106: of:= [.B105]+1 -> 256 | D106: 2340.97
B107: of:= [.B106]+1 -> 257 | D107: 2342.69
B108: of:= [.B107]+1 -> 258 | D108: 2344.51
B109: of:= [.B108]+1 -> 259 | D109: 2343.87
B110: of:= [.B109]+1 -> 260 | D110: 2344.22